siteId,gaiaId,regionName,propertyId,hotelName,hotelDesc,rating,address,imageURL
300000040,6359514,"Changi, Singapore, Singapore",2330793,ibis Singapore On Bencoolen,"Ibis Singapore On Bencoolen puts you just a 5-minute drive from Marina Bay Sands Casino and Bugis Street Shopping District. The restaurant is the perfect spot for a bite to eat, and after visiting the fitness center for a workout, you can unwind with a drink at the bar/lounge. Also, Gardens by the Bay and Marina Bay Sands Skypark are just a 5-minute drive away. Fellow travelers like that it's just a short walk to public transportation: Rochor MRT Station is 5 minutes away and Bencoolen Station is 5 minutes. ",8.4/10 Very Good,"170 Bencoolen Street, Singapore, 189657",https://images.trvl-media.com/lodging/3000000/2340000/2330800/2330793/68c91e60.jpg?impolicy=resizecrop&rw=1200&ra=fit
300000040,6359514,"Changi, Singapore, Singapore",182973,Village Hotel Changi by Far East Hospitality,"Village Hotel Changi by Far East Hospitality offers a free airport shuttle at scheduled times. After splashing around at one of the 2 outdoor pools, guests can grab a bite to eat at the restaurant. Other highlights at this upscale hotel include a 24-hour fitness center, a fitness center, and a seasonal outdoor pool. The helpful staff and location get good marks from fellow travelers.   ",8.0/10 Very Good,"1 Netheravon Road, Singapore, 508502",https://images.trvl-media.com/lodging/1000000/190000/183000/182973/cdf24a51.jpg?impolicy=resizecrop&rw=1200&ra=fit
300000040,6359514,"Changi, Singapore, Singapore",37996413,YOTELAIR Singapore Changi Airport,"At YOTELAIR Singapore Changi Airport, you'll be 3.7 mi (6 km) from Singapore Expo and 3.9 mi (6.3 km) from East Coast Park. Other highlights include a 24-hour fitness center and a fitness center. The comfortable beds and helpful staff get good marks from fellow travelers. Public transportation is just a short walk: C Station is 12 minutes and E Station is 12 minutes.   ",8.0/10 Very Good,"78 Airport Boulevard, Changi, #04-280, Singapore, 819666",https://images.trvl-media.com/lodging/38000000/38000000/37996500/37996413/134fd48b.jpg?impolicy=resizecrop&rw=1200&ra=fit
300000040,6359514,"Changi, Singapore, Singapore",182973,Village Hotel Changi by Far East Hospitality,"Village Hotel Changi by Far East Hospitality offers a free airport shuttle at scheduled times. After splashing around at one of the 2 outdoor pools, guests can grab a bite to eat at the restaurant. Other highlights at this upscale hotel include a 24-hour fitness center, a fitness center, and a seasonal outdoor pool. The helpful staff and location get good marks from fellow travelers.   ",8.0/10 Very Good,"1 Netheravon Road, Singapore, 508502",https://images.trvl-media.com/lodging/1000000/190000/183000/182973/cdf24a51.jpg?impolicy=resizecrop&rw=1200&ra=fit
300000040,6359514,"Changi, Singapore, Singapore",2057692,"Crowne Plaza Changi Airport, an IHG Hotel","Just 0.9 mi (1.4 km) from the airport, Crowne Plaza Changi Airport, an IHG Hotel puts you 3.6 mi (5.8 km) from Singapore Expo and 3.7 mi (6 km) from East Coast Park. You can splash around at the outdoor pool, visit one of the 2 restaurants for a bite to eat, or unwind with a drink at the bar/lounge. Other highlights at this luxurious hotel include a fitness center, a terrace, and a garden. The pool and comfortable beds get great marks from fellow travelers. Public transportation is just a short walk: C Station is 4 minutes and B Station is 6 minutes.   ",9.2/10 Wonderful,"75 Airport Boulevard, Singapore, 819644",https://images.trvl-media.com/lodging/3000000/2060000/2057700/2057692/606cae7d.jpg?impolicy=resizecrop&rw=1200&ra=fit
300000040,6359514,"Changi, Singapore, Singapore",9625754,Hilton Garden Inn Singapore Serangoon,"Hilton Garden Inn Singapore Serangoon puts you just a 5-minute drive from Marina Bay Sands Casino and Bugis Street Shopping District. The outdoor pool is a great spot to take a dip, and guests can grab a bite to eat at Together & Co., which serves international cuisine and is open for breakfast, lunch, and dinner. This upscale hotel also features a bar/lounge, a 24-hour fitness center, and a fitness center. Fellow travelers say good things about the helpful staff and overall property condition. Public transportation is just a short walk: Little India Station is 4 minutes and Farrer Park Station is 7 minutes.   ",8.2/10 Very Good,"3 Belilios Road, Singapore, 219924",https://images.trvl-media.com/lodging/10000000/9630000/9625800/9625754/20d73f91.jpg?impolicy=resizecrop&rw=1200&ra=fit
300000040,6359514,"Changi, Singapore, Singapore",12511476,"Holiday Inn Express Singapore Katong, an IHG Hotel","Holiday Inn Express Singapore Katong, an IHG Hotel puts you within a 10-minute drive of Marina Bay Sands Casino and Marina Bay Sands Skypark. The restaurant is the perfect spot for a bite to eat, and after visiting the 24-hour fitness center for a workout, you can unwind with a drink at the bar/lounge. Also, Bugis Street Shopping District and Gardens by the Bay are within a short drive. Fellow travelers like the overall property condition and location. The property is just a short walk to public transportation: Marine Parade Station is 6 minutes away.   ",8.8/10 Excellent,"88 East Coast Road, Katong Square, Singapore, 423371",https://images.trvl-media.com/lodging/13000000/12520000/12511500/12511476/a440ed2b.jpg?impolicy=resizecrop&rw=1200&ra=fit
300000040,6359514,"Changi, Singapore, Singapore",13434756,Ambassador Transit Hotel Terminal 2,"At Ambassador Transit Hotel Terminal 2, you'll be 3.3 mi (5.3 km) from Singapore Expo and 3.5 mi (5.6 km) from East Coast Park. The property is just a short walk to public transportation: E Station is 2 minutes and F Station is 3 minutes.   ",8.2/10 Very Good,"Singapore Changi Airport, PTB2, Departure, Level 3, Terminal 2, Singapore, 918155",https://images.trvl-media.com/lodging/14000000/13440000/13434800/13434756/02b5cd82.jpg?impolicy=resizecrop&rw=1200&ra=fit
300000040,6359514,"Changi, Singapore, Singapore",5312974,"Capri by Fraser Changi City, Singapore","Located 4.6 mi (7.4 km) from the airport, Capri by Fraser Changi City, Singapore puts you 0.4 mi (0.7 km) from Singapore Expo and 2.6 mi (4.2 km) from East Coast Park. The restaurant is the perfect spot for a bite to eat, and after visiting the 24-hour fitness center for a workout, you can unwind with a drink at the bar/lounge. An outdoor pool and a sauna are offered, and in-room conveniences include refrigerators and microwaves. Public transportation is close by: Expo Station is just 11 minutes by foot.   ",9.0/10 Wonderful,"3 Changi Business Park Central 1, Singapore, 486037",https://images.trvl-media.com/lodging/6000000/5320000/5313000/5312974/9b7958bf.jpg?impolicy=resizecrop&rw=1200&ra=fit
300000040,6359514,"Changi, Singapore, Singapore",73360826,Hotel Traveltine,"Hotel Traveltine puts you just a 5-minute drive from Marina Bay Sands Casino and Bugis Street Shopping District. After having fun at the outdoor pool, you can grab a bite to eat at the restaurant. This upscale hotel is also just a 5-minute drive from Gardens by the Bay and Marina Bay Sands Skypark. The property is just a short walk to public transportation: Nicoll Highway Station is 6 minutes and Lavender Station is 11 minutes.   ",8.0/10 Very Good,"700 Beach Rd, Singapore, 199598",https://images.trvl-media.com/lodging/74000000/73370000/73360900/73360826/91c8b6c8.jpg?impolicy=resizecrop&rw=1200&ra=fit
300000040,6359514,"Changi, Singapore, Singapore",6482511,Park Avenue Changi,"Located 4.4 mi (7 km) from the airport, Park Avenue Changi puts you 0.3 mi (0.4 km) from Singapore Expo and 2.7 mi (4.3 km) from East Coast Park. The restaurant is the perfect spot for a bite to eat, and after visiting the fitness center for a workout, you can unwind with a drink at the bar/lounge. Also, this hotel is within a short drive of Bugis Street Shopping District. Fellow travelers say good things about the helpful staff and airport proximity. The property is just a short walk to public transportation: Expo Station is 11 minutes and Upper Changi Station is 14 minutes.   ",8.4/10 Very Good,"2 Changi Business Park Avenue 1, Singapore, 486015",https://images.trvl-media.com/lodging/7000000/6490000/6482600/6482511/b1897a79.jpg?impolicy=resizecrop&rw=1200&ra=fit
300000040,6359514,"Changi, Singapore, Singapore",6980410,Changi Cove,"Changi Cove features a rooftop terrace and puts you 4.7 mi (7.6 km) from Singapore Expo. Guests can visit the fitness center for a workout or grab a bite to eat at The White Olive, which serves local and international cuisine and is open for lunch and dinner. Fellow travelers like the helpful staff.   ",8.4/10 Very Good,"351 Cranwell Road, Singapore, 509866",https://images.trvl-media.com/lodging/7000000/6990000/6980500/6980410/9ffc28ba.jpg?impolicy=resizecrop&rw=1200&ra=fit
300000040,6359514,"Changi, Singapore, Singapore",42723659,Dusit Thani Laguna Singapore,"Dusit Thani Laguna Singapore is just 4.2 mi (6.8 km) from the airport and offers a free shuttle (available on request). Guests can visit the spa to indulge in massages, facials, or body scrubs, and local and international cuisine is served at Greenhouse, which is open for breakfast, lunch, and dinner. Other highlights at this luxurious hotel include 3 outdoor pools, a golf course, and a poolside bar. Fellow travelers like the pool and helpful staff. The property is just a short walk to public transportation: Xilin Station is 8 minutes away.   ",8.6/10 Excellent,"11 Laguna Golf Green, Singapore, 488047",https://images.trvl-media.com/lodging/43000000/42730000/42723700/42723659/ff034e6b.jpg?impolicy=resizecrop&rw=1200&ra=fit
300000040,6359514,"Changi, Singapore, Singapore",15061900,D'Resort at Downtown East,D'Resort at Downtown East puts you 3.6 mi (5.8 km) from Singapore Expo. Guests can splash around at the water park or grab a bite to eat at the coffee shop/cafe. Fellow travelers say good things about the helpful staff and overall property condition. Public transportation is close by: Pasir Ris Station is just 15 minutes by foot.   ,8.0/10 Very Good,"1 Pasir Ris Close, Singapore, 519599",https://images.trvl-media.com/lodging/16000000/15070000/15061900/15061900/65ee7ba2.jpg?impolicy=resizecrop&rw=1200&ra=fit
300000040,6005085,"Chinatown, Singapore, Singapore",27537658,"Maxwell Reserve Singapore, Autograph Collection","Maxwell Reserve Singapore, Autograph Collection puts you just a 5-minute drive from Marina Bay Sands Casino and Marina Bay Sands Skypark. The outdoor pool is a great spot to take a dip, and guests can grab a bite to eat at Cultivate Cafe, one of 2 restaurants, which serves vegan cuisine and is open for breakfast, lunch, and dinner. Other highlights at this luxurious hotel include 2 bars/lounges, a fitness center, and a terrace. Public transportation is just a short walk: Maxwell Station is 3 minutes and Tanjong Pagar Station is 6 minutes.   ",8.8/10 Excellent,"2 Cook Street, Singapore, 78857",https://images.trvl-media.com/lodging/28000000/27540000/27537700/27537658/0c443c14.jpg?impolicy=resizecrop&rw=1200&ra=fit
300000040,6005085,"Chinatown, Singapore, Singapore",892933,"Duxton Reserve Singapore, Autograph Collection","Duxton Reserve Singapore, Autograph Collection puts you just a 5-minute drive from Marina Bay Sands Casino and Marina Bay Sands Skypark. Guests looking for a bite to eat can check out the restaurant, and the bar/lounge is the perfect spot to grab a drink at the end of the day. This luxurious hotel is also just a 5-minute drive from Gardens by the Bay and Bugis Street Shopping District. The property is just a short walk to public transportation: Maxwell Station is 3 minutes and Tanjong Pagar Station is 6 minutes.   ",8.6/10 Excellent,"83 Duxton Road, Singapore, 089540",https://images.trvl-media.com/lodging/1000000/900000/893000/892933/83a03e7e.jpg?impolicy=resizecrop&rw=1200&ra=fit
300000040,6005085,"Chinatown, Singapore, Singapore",91580180,Mondrian Singapore Duxton,"Mondrian Singapore Duxton puts you just a 5-minute drive from Marina Bay Sands Casino and Marina Bay Sands Skypark. Guests can take a dip in the outdoor pool or grab a bite to eat at Bottega Di Carna, which is one of 4 restaurants and serves breakfast, lunch, and dinner. Other highlights at this upscale hotel include a fitness center and a poolside bar. The property is just a short walk to public transportation: Maxwell Station is 4 minutes and Tanjong Pagar Station is 10 minutes.   ",8.4/10 Very Good,"16A DUXTON HILL, Singapore, 089970",https://images.trvl-media.com/lodging/92000000/91590000/91580200/91580180/d20053e7.jpg?impolicy=resizecrop&rw=1200&ra=fit
300000040,6005085,"Chinatown, Singapore, Singapore",1141522,The Scarlet Hotel,"When you stay at The Scarlet Hotel, you'll be just a 5-minute drive from Marina Bay Sands Casino and Marina Bay Sands Skypark. Guests can be pampered with massages at the spa. Other highlights at this upscale hotel include a fitness center and a terrace. The helpful staff and location get great marks from fellow travelers. The property is just a short walk to public transportation: Maxwell Station is 3 minutes and Telok Ayer Station is 7 minutes.   ",8.4/10 Very Good,"33 Erskine Road, Singapore, 069333",https://images.trvl-media.com/lodging/2000000/1150000/1141600/1141522/6584e750.jpg?impolicy=resizecrop&rw=1200&ra=fit
300000040,6005085,"Chinatown, Singapore, Singapore",8639079,Orchid Hotel,"When you stay at Orchid Hotel, you'll be just a 5-minute drive from Marina Bay Sands Casino and Marina Bay Sands Skypark. Guests can take a dip in the outdoor pool or grab a bite to eat at Ya Ge(Chinese Restaurant), which serves breakfast, lunch, and dinner. Other highlights at this upscale hotel include a bar/lounge and a garden. Public transportation is just a short walk: Tanjong Pagar Station is 3 minutes and Maxwell Station is 7 minutes.   ",8.4/10 Very Good,"1 Tras Link (Tanjong Pagar), Singapore, 078867",https://images.trvl-media.com/lodging/9000000/8640000/8639100/8639079/21f1b279.jpg?impolicy=resizecrop&rw=1200&ra=fit
300000040,6005085,"Chinatown, Singapore, Singapore",37207055,"KÄ“Sa House, The Unlimited Collection by Oakwood","At KēSa House, The Unlimited Collection by Oakwood, you'll be just a 5-minute drive from Marina Bay Sands Casino and Bugis Street Shopping District. You can relax with a drink at the bar/lounge, and the 4 restaurants are nice spots to grab a bite to eat. Also, Marina Bay Sands Skypark and Gardens by the Bay are just a 5-minute drive away. Fellow travelers like the helpful staff and location. The property is just a short walk to public transportation: Outram Park Station is 6 minutes and Maxwell Station is 7 minutes.   ",9.2/10 Wonderful,"55 Keong Saik Rd., Singapore, 089158",https://images.trvl-media.com/lodging/38000000/37210000/37207100/37207055/acf4196d.jpg?impolicy=resizecrop&rw=1200&ra=fit
300000040,6005085,"Chinatown, Singapore, Singapore",4128991,Hotel 1900,"When you stay at Hotel 1900, you'll be just a 5-minute drive from Marina Bay Sands Casino and Bugis Street Shopping District. You'll have free perks like WiFi and wired Internet. Other highlights at this boutique hotel include a terrace and a garden. Public transportation is just a short walk: Chinatown Station is 3 minutes and Telok Ayer Station is 6 minutes.   ",10.0/10 Exceptional,"48 Mosque Street, Singapore, 059526",https://images.trvl-media.com/lodging/5000000/4130000/4129000/4128991/364b8a5f.jpg?impolicy=resizecrop&rw=1200&ra=fit
300000040,6005085,"Chinatown, Singapore, Singapore",6076571,Carlton City Hotel Singapore,"When you stay at Carlton City Hotel Singapore, you'll be just a 5-minute drive from Marina Bay Sands Casino and Marina Bay Sands Skypark. Guests can take a dip in the outdoor pool or grab a bite to eat at Plate, which serves breakfast, lunch, and dinner. This luxurious hotel is also just a 5-minute drive from Gardens by the Bay and Bugis Street Shopping District. Fellow travelers love the helpful staff and location. The property is just a short walk to public transportation: Tanjong Pagar Station is 4 minutes and Maxwell Station is 8 minutes.   ",9.0/10 Wonderful,"1 Gopeng Street, Singapore, 078862",https://images.trvl-media.com/lodging/7000000/6080000/6076600/6076571/53271844.jpg?impolicy=resizecrop&rw=1200&ra=fit
300000040,6005085,"Chinatown, Singapore, Singapore",15056512,The Southbridge Hotel,"At The Southbridge Hotel, you'll be just a 5-minute drive from Marina Bay Sands Casino and Bugis Street Shopping District. The bar is a great place to grab a drink, and guests looking for a bite to eat can check out Restaurant Bar Jazz, which serves American cuisine and is open for lunch and dinner. Also, Marina Bay Sands Skypark and Gardens by the Bay are just a 5-minute drive away. Fellow travelers say good things about the bar and location. The property is just a short walk to public transportation: Telok Ayer Station is 4 minutes and Maxwell Station is 5 minutes.   ",7.8/10 Good,"210 South Bridge Road, Singapore, 058759",https://images.trvl-media.com/lodging/16000000/15060000/15056600/15056512/2da60be0.jpg?impolicy=resizecrop&rw=1200&ra=fit
300000040,6005085,"Chinatown, Singapore, Singapore",906145,Amara Singapore,"At Amara Singapore, you'll be just a 5-minute drive from Marina Bay Sands Casino and Marina Bay Sands Skypark. Guests can take a dip in the outdoor pool or grab a bite to eat at Element, which is one of 5 restaurants and serves breakfast, lunch, and dinner. Other highlights at this luxurious hotel include a bar/lounge, a fitness center, and a snack bar/deli. The helpful staff and location get good marks from fellow travelers. The property is just a short walk to public transportation: Tanjong Pagar Station is 5 minutes and Maxwell Station is 9 minutes.   ",8.0/10 Very Good,"165 Tanjong Pagar Road, Singapore, 088539",https://images.trvl-media.com/lodging/1000000/910000/906200/906145/ae7ef166.jpg?impolicy=resizecrop&rw=1200&ra=fit
300000040,6005085,"Chinatown, Singapore, Singapore",42363019,ST Signature Tanjong Pagar,"At ST Signature Tanjong Pagar, you'll be just a 5-minute drive from Marina Bay Sands Casino and Marina Bay Sands Skypark. You can relax with a drink at the bar/lounge, and the restaurant is the perfect spot to grab a bite to eat. Also, Gardens by the Bay and Bugis Street Shopping District are just a 5-minute drive away. The helpful staff and location get good marks from fellow travelers. Public transportation is just a short walk: Maxwell Station is 4 minutes and Tanjong Pagar Station is 5 minutes.   ",8.0/10 Very Good,"32 Tras St, Singapore, 078972",https://images.trvl-media.com/lodging/43000000/42370000/42363100/42363019/6753facd.jpg?impolicy=resizecrop&rw=1200&ra=fit
300000040,6005085,"Chinatown, Singapore, Singapore",27537658,"Maxwell Reserve Singapore, Autograph Collection","Maxwell Reserve Singapore, Autograph Collection puts you just a 5-minute drive from Marina Bay Sands Casino and Marina Bay Sands Skypark. The outdoor pool is a great spot to take a dip, and guests can grab a bite to eat at Cultivate Cafe, one of 2 restaurants, which serves vegan cuisine and is open for breakfast, lunch, and dinner. Other highlights at this luxurious hotel include 2 bars/lounges, a fitness center, and a terrace. Public transportation is just a short walk: Maxwell Station is 3 minutes and Tanjong Pagar Station is 6 minutes.   ",8.8/10 Excellent,"2 Cook Street, Singapore, 78857",https://images.trvl-media.com/lodging/28000000/27540000/27537700/27537658/b66a3c4b.jpg?impolicy=resizecrop&rw=1200&ra=fit
300000040,6005085,"Chinatown, Singapore, Singapore",5659305,Dorsett Singapore,"Dorsett Singapore puts you just a 5-minute drive from Marina Bay Sands Casino and Bugis Street Shopping District. The outdoor pool is a great spot to take a dip, and guests can grab a bite to eat at SENSHI, which serves Japanese cuisine and is open for lunch and dinner. Other highlights at this upscale hotel include a fitness center and a bar/lounge. Fellow travelers like the location. Public transportation is just a short walk: Outram Park Station is 4 minutes and Maxwell Station is 8 minutes.   ",8.2/10 Very Good,"333 New Bridge Road, Singapore, 088765",https://images.trvl-media.com/lodging/6000000/5660000/5659400/5659305/ff37b06b.jpg?impolicy=resizecrop&rw=1200&ra=fit
300000040,6005085,"Chinatown, Singapore, Singapore",3891794,Hotel 81 Chinatown,"When you stay at Hotel 81 Chinatown, you'll be just a 5-minute drive from Marina Bay Sands Casino and Bugis Street Shopping District. Also, Marina Bay Sands Skypark and Gardens by the Bay are just a 5-minute drive away. Public transportation is just a short walk: Chinatown Station is 3 minutes and Clarke Quay Station is 7 minutes.   ",6.4/10 Good,"181 New Bridge Road, Singapore, 059418",https://images.trvl-media.com/lodging/4000000/3900000/3891800/3891794/6c8f0dae.jpg?impolicy=resizecrop&rw=1200&ra=fit
300000040,502825,"Jurong Bird Park, Singapore, Singapore",9644785,The Quay Hotel West Coast,"Placing you within a 15-minute drive of Universal Studios Singapore and Marina Bay Sands Casino, The Quay Hotel West Coast offers an airport shuttle (available 24 hours) for SGD 55 per vehicle. Guests indulge in massages, then grab a bite to eat at the restaurant. Also, Orchard Road and Bugis Street Shopping District are within a short drive.   ",7.2/10 Good,"428 Pasir Panjang Road, Singapore, 118769",https://images.trvl-media.com/lodging/10000000/9650000/9644800/9644785/0b103634.jpg?impolicy=resizecrop&rw=1200&ra=fit
300000040,502825,"Jurong Bird Park, Singapore, Singapore",88627722,Citadines Connect Rochester Singapore,"At Citadines Connect Rochester Singapore, you'll be within a 15-minute drive of Marina Bay Sands Casino and Universal Studios Singapore. There's also an outdoor pool, and apartments offer Smart TVs and slippers. Fellow travelers say great things about the helpful staff and location. The property is just a short walk to public transportation: Buona Vista Station is 5 minutes and One-North Station is 12 minutes.   ",9.4/10 Exceptional,"1 Rochester Park, Singapore",https://images.trvl-media.com/lodging/89000000/88630000/88627800/88627722/af2de6eb.jpg?impolicy=resizecrop&rw=1200&ra=fit
300000040,502825,"Jurong Bird Park, Singapore, Singapore",71254754,lyf One-North Singapore,"Featuring a rooftop terrace, lyf One-North Singapore puts you within a 10-minute drive of Orchard Road. You can visit the fitness center for a workout or unwind with a drink at the bar/lounge. Other highlights include an outdoor pool and a garden. The property is just a short walk to public transportation: One-North Station is 5 minutes and Buona Vista Station is 12 minutes.   ",9.0/10 Wonderful,"80 Nepal Park, Singapore, 139409",https://images.trvl-media.com/lodging/72000000/71260000/71254800/71254754/b63ae4b7.jpg?impolicy=resizecrop&rw=1200&ra=fit
300000040,502825,"Jurong Bird Park, Singapore, Singapore",4715695,Park Avenue Rochester,"Park Avenue Rochester features an airport shuttle and puts you within a 15-minute drive of Marina Bay Sands Casino and Universal Studios Singapore. After having fun at the outdoor pool, you can grab a bite to eat at the restaurant or unwind with a drink at the bar/lounge. Other highlights at this upscale hotel include a fitness center, a terrace, and a garden. The property is just a short walk to public transportation: Buona Vista Station is 6 minutes and One-North Station is 12 minutes.   ",8.4/10 Very Good,"31 Rochester Drive, Singapore, 138637",https://images.trvl-media.com/lodging/5000000/4720000/4715700/4715695/9cdc86a4.jpg?impolicy=resizecrop&rw=1200&ra=fit
300000040,502825,"Jurong Bird Park, Singapore, Singapore",9988732,Momentus Hotel Alexandra,"When you stay at Momentus Hotel Alexandra, you'll be within a 10-minute drive of Marina Bay Sands Casino and Universal Studios Singapore. After having fun at the outdoor pool, you can grab a bite to eat at the restaurant or unwind with a drink at the bar/lounge. Other highlights include a poolside bar, a fitness center, and a children's pool. Fellow travelers say good things about the overall property condition. The property is just a short walk to public transportation: Queenstown Station is 13 minutes away.   ",7.2/10 Good,"323 Alexandra Road, Singapore, 159972",https://images.trvl-media.com/lodging/10000000/9990000/9988800/9988732/fe7985dc.jpg?impolicy=resizecrop&rw=1200&ra=fit
300000040,502825,"Jurong Bird Park, Singapore, Singapore",76936991,Coller Boutique Hostel,"When you stay at Coller Boutique Hostel, you'll be just a 5-minute drive from Marina Bay Sands Casino and Orchard Road. You can unwind with a drink at the bar/lounge, and the coffee shop/cafe is the perfect spot to grab a bite to eat. Also, Bugis Street Shopping District and Marina Bay Sands Skypark are just a 5-minute drive away. The property is just a short walk to public transportation: Havelock Station is 7 minutes and Outram Park Station is 9 minutes.   ",6.0/10 Good,"259 Outram Road, Chinatown, Singapore, Singapore, 169056",https://images.trvl-media.com/lodging/77000000/76940000/76937000/76936991/3afc86ec.jpg?impolicy=resizecrop&rw=1200&ra=fit
